{
  "$schema": "https://json-schema.org/draft/2020-12/schema",
  "$id": "https://example.invalid/everything-exam-preparation/run_manifest.schema.json",
  "title": "RunManifest",
  "type": "object",
  "required": ["run_id", "created_at", "request_scope", "source_hashes", "actions", "object_store", "artifacts", "qa_summary"],
  "properties": {
    "object_type": { "const": "RunManifest" },
    "run_id": { "type": "string" },
    "created_at": { "type": "string" },
    "request_scope": { "type": "string" },
    "source_hashes": { "type": "object" },
    "actions": {
      "type": "array",
      "items": {
        "type": "object",
        "required": ["action_id", "action_type", "status", "inputs", "outputs"],
        "properties": {
          "action_id": { "type": "string" },
          "action_type": { "type": "string" },
          "status": { "enum": ["planned", "skipped", "pass", "fail", "blocked"] },
          "inputs": { "type": "array" },
          "outputs": { "type": "array" }
        },
        "additionalProperties": true
      }
    },
    "object_store": { "type": "object" },
    "artifacts": { "type": "array" },
    "qa_summary": { "type": "object" }
  },
  "additionalProperties": true
}
